{
  "receipt_version": "witnessops.receipt.v0",
  "workflow_class": "privileged_access_approval_synthetic_public_proof_run",
  "proof_run_id": "pr_20260426_synthetic_access_approval_public_001",
  "result": {
    "outcome": "pass",
    "failure_states": []
  },
  "claims": [
    {
      "claim": "synthetic_scope_declared",
      "status": "passed",
      "evidence_refs": ["access_request", "boundary_and_failures"]
    },
    {
      "claim": "approval_preceded_execution",
      "status": "passed",
      "evidence_refs": ["approval_record", "execution_log"]
    },
    {
      "claim": "prohibited_actions_absent",
      "status": "passed",
      "evidence_refs": ["execution_log", "boundary_and_failures"]
    }
  ],
  "manifest_hash": "sha256:ffffffffffffffffffffffffffffffffffffffffffffffffffffffffffffffff",
  "signature": {
    "algorithm": "ed25519",
    "public_key_id": "synthetic_public_proof_run_key_placeholder",
    "signature": "sample_signature_not_for_production"
  }
}
